> status

STATUS
  PWR_EN / PMIC VR enable (GPIO33): ON/RELEASED (read=HIGH)
  PWR_GOOD (GPIO34): READY
  VIN_BULK switch (GPIO32): ON
  HSA GPIO (GPIO27): RELEASED
  HSA note: GPIO27 control is experimental; released GPIO lets the external strap decide.
  Auto-detect determines the active SPD/HUB address. Cold-cycle VIN_BULK after HSA changes.
  scanOK=yes readOK=no dumpOK=yes
  Known-good SPD reference=PRESENT  crc32=0x56DE1224
  PMIC reference=MISSING
  MR11@0x50=?? (read failed)
  WiFi AP: ESP32_SPD_TOOL  pass: spdtool123  ip: 192.168.4.1
  lastScanCount=3


> scan
I2C scan:
  Found device at 0x4B
  Found device at 0x53
  Found device at 0x7E

> autodetect

Auto-detect roles (read-only)
  No PWR_EN, HSA, or VIN_BULK state changes are performed.
Auto-detect roles:
  0x4B  PMIC                   confidence=high  reason=PMIC ID regs 0x3C/0x3D returned 0x0D 0x85
  0x53  SPD_HUB                confidence=high  reason=SPD offset 0x0000 read starts 30 10 12 02
  0x7E  RESERVED               confidence=medium  reason=I3C reserved/broadcast style address; no actions assigned


> map

========== AUTO MAP ==========
Mode: GPIO RELEASED (external HSA strap decides, no switching performed)
HSA GPIO: RELEASED
VIN_BULK: ON
Requested SPD addr:  0x50
Requested PMIC addr: 0x48
Requested HUB addr:  0x53
NOTE: mapper is read-only and does NOT switch HSA or cold-cycle VIN_BULK.

========== BUS SCAN ==========
I2C scan:
  Found device at 0x4B
  Found device at 0x53
  Found device at 0x7E

========== SCAN CLASSIFICATION ==========
Detected SPD/HUB candidate: 0x53
Detected PMIC candidate:    0x4B
  0x4B -> PMIC?
  0x53 -> SPD/HUB
  0x7E -> SPECIAL/CCC

========== RESOLVED TARGETS ==========
Resolved SPD/HUB addr: 0x53
Resolved PMIC addr:    0x4B

========== SPD FULL DUMP (1024 BYTES) ==========
Dumping 1024 bytes (NVM) from 0x53...
0000: 30 10 12 02 04 00 40 42 00 00 00 00 10 02 00 00 
0010: 00 00 00 00 A0 01 F2 03 7A 0D 00 00 00 00 80 3E 
0020: 80 3E 80 3E 00 7D 80 BB 30 75 27 01 A0 00 82 00 
0030: 00 00 00 00 00 00 00 00 00 00 00 00 00 00 00 00 
0040: 00 00 00 00 00 00 88 13 08 88 13 08 20 4E 20 10 
0050: 27 10 1A 41 20 10 27 10 C4 09 04 4C 1D 0C 00 00 
0060: 00 00 00 00 00 00 00 00 00 00 00 00 00 00 00 00 
0070: 00 00 00 00 00 00 00 00 00 00 00 00 00 00 00 00 
0080: 00 00 00 00 00 00 00 00 00 00 00 00 00 00 00 00 
0090: 00 00 00 00 00 00 00 00 00 00 00 00 00 00 00 00 
00A0: 00 00 00 00 00 00 00 00 00 00 00 00 00 00 00 00 
00B0: 00 00 00 00 00 00 00 00 00 00 00 00 00 00 00 00 
00C0: 10 00 0B 10 80 12 0D 85 82 02 00 00 00 00 00 00 
00D0: 00 00 00 00 00 00 00 00 00 00 00 00 00 00 00 00 
00E0: 00 00 00 00 00 00 11 01 02 81 00 22 00 00 00 00 
00F0: 00 00 00 00 00 00 00 00 00 00 00 00 00 00 00 00 
0100: 00 00 00 00 00 00 00 00 00 00 00 00 00 00 00 00 
0110: 00 00 00 00 00 00 00 00 00 00 00 00 00 00 00 00 
0120: 00 00 00 00 00 00 00 00 00 00 00 00 00 00 00 00 
0130: 00 00 00 00 00 00 00 00 00 00 00 00 00 00 00 00 
0140: 00 00 00 00 00 00 00 00 00 00 00 00 00 00 00 00 
0150: 00 00 00 00 00 00 00 00 00 00 00 00 00 00 00 00 
0160: 00 00 00 00 00 00 00 00 00 00 00 00 00 00 00 00 
0170: 00 00 00 00 00 00 00 00 00 00 00 00 00 00 00 00 
0180: 00 00 00 00 00 00 00 00 00 00 00 00 00 00 00 00 
0190: 00 00 00 00 00 00 00 00 00 00 00 00 00 00 00 00 
01A0: 00 00 00 00 00 00 00 00 00 00 00 00 00 00 00 00 
01B0: 00 00 00 00 00 00 00 00 00 00 00 00 00 00 00 00 
01C0: 00 00 00 00 00 00 00 00 00 00 00 00 00 00 00 00 
01D0: 00 00 00 00 00 00 00 00 00 00 00 00 00 00 00 00 
01E0: 00 00 00 00 00 00 00 00 00 00 00 00 00 00 00 00 
01F0: 00 00 00 00 00 00 00 00 00 00 00 00 00 00 51 B2 
0200: 8C 5D 00 24 43 83 32 00 00 44 35 55 30 38 35 32 
0210: 33 38 32 42 2D 4B 36 39 00 00 00 00 00 00 00 00 
0220: 00 00 00 00 00 00 00 00 80 CE 00 00 00 00 00 00 
0230: 00 00 00 00 00 00 00 00 00 00 00 00 00 00 00 00 
0240: 00 00 00 00 00 00 00 00 00 00 00 00 00 00 00 00 
0250: 00 00 00 00 00 00 00 00 00 00 00 00 00 00 00 00 
0260: 00 00 48 03 00 08 01 00 00 00 00 00 00 00 00 00 
0270: 00 00 00 00 00 00 00 00 00 00 00 00 00 00 00 00 
0280: 0C 4A 30 01 15 0D 85 01 03 00 00 00 00 00 00 00 
0290: 00 00 00 00 00 00 00 00 00 00 00 00 00 00 00 00 
02A0: 00 00 00 00 00 00 00 00 00 00 00 00 00 00 00 00 
02B0: 00 00 00 00 00 00 00 00 00 00 00 00 00 00 4B 8B 
02C0: 30 25 25 00 20 80 01 FA FF 00 00 00 00 00 39 00 
02D0: 3C 00 3C 00 72 00 AE 30 75 27 01 A0 00 82 00 00 
02E0: 00 00 00 00 00 00 00 00 00 00 00 00 00 00 00 00 
02F0: 00 00 00 00 00 00 00 00 00 00 00 00 00 00 BD C9 
0300: 00 00 00 00 00 00 00 00 00 00 00 00 00 00 00 00 
0310: 00 00 00 00 00 00 00 00 00 00 00 00 00 00 00 00 
0320: 00 00 00 00 00 00 00 00 00 00 00 00 00 00 00 00 
0330: 00 00 00 00 00 00 00 00 00 00 00 00 00 00 00 00 
0340: 45 58 50 4F 10 03 01 00 00 00 25 25 30 00 80 01 
0350: 00 39 00 3C 00 3C 00 72 00 AE 30 75 27 01 A0 00 
0360: 82 00 00 00 00 00 00 00 00 00 00 00 00 00 00 00 
0370: 00 00 00 00 00 00 00 00 00 00 00 00 00 00 00 00 
0380: 00 00 00 00 00 00 00 00 00 00 00 00 00 00 00 00 
0390: 00 00 00 00 00 00 00 00 00 00 00 00 00 00 00 00 
03A0: 00 00 00 00 00 00 00 00 00 00 00 00 00 00 00 00 
03B0: 00 00 00 00 00 00 00 00 00 00 00 00 00 00 AB D0 
03C0: 00 00 00 00 00 00 00 00 00 00 00 00 00 00 00 00 
03D0: 00 00 00 00 00 00 00 00 00 00 00 00 00 00 00 00 
03E0: 00 00 00 00 00 00 00 00 00 00 00 00 00 00 00 00 
03F0: 00 00 00 00 00 00 00 00 00 00 00 00 00 00 00 00 
Done.

========== HUB KEY REGS ==========
REG: addr 0x53 reg 0x00 len 7
00: 51 18 12 0B 10 03 52 
REG: addr 0x53 reg 0x0B len 4
0B: 07 FF 3C 00 
REG: addr 0x53 reg 0x12 len 3
12: 00 00 00 
REG: addr 0x53 reg 0x1A len 6
1A: 00 00 70 03 00 00 
REG: addr 0x53 reg 0x20 len 6
20: 50 05 00 00 00 00 
REG: addr 0x53 reg 0x30 len 6
30: 00 8C 01 00 00 00 

========== HUB FULL REGISTER SWEEP 0x00-0x7F ==========
REG: addr 0x53 reg 0x00 len 16
00: 51 18 12 0B 10 03 52 00 00 00 00 07 FF 3C 00 00 
REG: addr 0x53 reg 0x10 len 16
10: 00 00 00 00 00 00 00 00 00 00 00 00 70 03 00 00 
REG: addr 0x53 reg 0x20 len 16
20: 50 05 00 00 00 00 00 00 00 00 00 00 00 00 00 00 
REG: addr 0x53 reg 0x30 len 16
30: 00 8C 01 00 00 00 00 00 00 00 00 00 00 00 00 00 
REG: addr 0x53 reg 0x40 len 16
40: 00 00 00 00 00 00 00 00 00 00 00 00 00 00 00 00 
REG: addr 0x53 reg 0x50 len 16
50: 00 00 00 00 00 00 00 00 00 00 00 00 00 00 00 00 
REG: addr 0x53 reg 0x60 len 16
60: 00 00 00 00 00 00 00 00 00 00 00 00 00 00 00 00 
REG: addr 0x53 reg 0x70 len 16
70: 00 00 00 00 00 00 00 00 00 00 00 00 00 00 00 00 

========== PMIC ID ==========
PMICID: reading ID bytes from 0x4B regs 0x3C/0x3D...
PMICID raw: 0x0D 0x85
PMICID JEP106-ish: bank/cont=13  code=0x05

========== PMIC KEY REGS ==========
REG: addr 0x4B reg 0x04 len 8
04: 00 00 00 00 00 00 00 00 
REG: addr 0x4B reg 0x08 len 8
08: 00 00 00 00 00 00 00 00 
REG: addr 0x4B reg 0x2F len 4
2F: 5E 00 00 80 
REG: addr 0x4B reg 0x35 len 5
35: 00 00 00 00 00 

========== PMIC FULL REGISTER SWEEP 0x00-0xFF ==========
REG: addr 0x4B reg 0x00 len 16
00: 00 00 00 00 00 00 00 00 00 00 00 00 00 00 00 00 
REG: addr 0x4B reg 0x10 len 16
10: 00 00 00 00 00 2C 20 00 00 04 00 05 60 00 60 60 
REG: addr 0x4B reg 0x20 len 16
20: CF 78 63 00 00 78 63 78 63 80 88 42 20 22 04 5E 
REG: addr 0x4B reg 0x30 len 16
30: 00 00 80 00 0E 00 00 00 00 00 00 00 0D 85 00 00 
REG: addr 0x4B reg 0x40 len 16
40: 00 00 00 00 00 00 00 00 00 00 00 00 00 00 00 00 
REG: addr 0x4B reg 0x50 len 16
50: 00 00 00 00 00 00 00 00 00 00 00 00 00 00 00 00 
REG: addr 0x4B reg 0x60 len 16
60: 00 00 00 00 00 00 00 00 00 00 00 00 00 00 00 00 
REG: addr 0x4B reg 0x70 len 16
70: 00 00 00 00 00 00 00 00 00 00 00 00 00 00 00 00 
REG: addr 0x4B reg 0x80 len 16
80: 00 00 00 00 00 00 00 00 00 00 00 00 00 00 00 00 
REG: addr 0x4B reg 0x90 len 16
90: 00 00 00 00 00 00 00 00 00 00 00 00 00 00 00 00 
REG: addr 0x4B reg 0xA0 len 16
A0: 00 00 00 00 00 00 00 00 00 00 00 00 00 00 00 00 
REG: addr 0x4B reg 0xB0 len 16
B0: 00 00 00 00 00 00 00 00 00 00 00 00 00 00 00 00 
REG: addr 0x4B reg 0xC0 len 16
C0: 00 00 00 00 00 00 00 00 00 00 00 00 00 00 00 00 
REG: addr 0x4B reg 0xD0 len 16
D0: 00 00 00 00 00 00 00 00 00 00 00 00 00 00 00 00 
REG: addr 0x4B reg 0xE0 len 16
E0: 00 00 00 00 00 00 00 00 00 00 00 00 00 00 00 00 
REG: addr 0x4B reg 0xF0 len 16
F0: 00 00 00 00 00 00 00 00 00 00 00 00 00 00 00 00 

========== AUTO MAP COMPLETE ==========
